{
  "pieza": "bestiario",
  "decision": "D-73",
  "actualizado": "2026-10-18",
  "nota": "El bestiario redondo: los bichos y la gente que viven en las letras de los diez discos, más los tres del mito que no salen de ninguna letra. Cada uno vive en una región del mundo redondo, al lado de los que se le parecen. El verso de cada ficha se coteja a máquina contra cancionero.json (bestiario.test.ts); lo que se cuenta aparte lleva su rótulo. La estampa es el dibujo del sitio y dice lo que agrega a la letra.",
  "regiones": [
    {
      "id": "el-galpon",
      "corto": "El galpón",
      "nombre": "El galpón de Patricio Rey",
      "canta": "Una silla vacía en el medio.",
      "disco": "marca",
      "forma": { "tipo": "centro", "radio": 135 },
      "vecinas": ["la-mesa", "el-arbol", "el-templo", "el-bajo"]
    },
    {
      "id": "el-arbol",
      "corto": "El árbol",
      "nombre": "El árbol del gran bonete",
      "canta": "Un fruto raro, caro de morder.",
      "disco": "luzbelito",
      "forma": { "tipo": "sector", "desde": -20, "hasta": 20, "adentro": 140, "afuera": 425 },
      "vecinas": ["cybersiberia", "el-monte", "el-galpon", "la-ruta"]
    },
    {
      "id": "cybersiberia",
      "corto": "Cybersiberia",
      "nombre": "Cybersiberia",
      "canta": "La tele prendida en la nieve.",
      "disco": "ultimo-bondi-a-finisterre",
      "forma": { "tipo": "sector", "desde": 20, "hasta": 65, "adentro": 140, "afuera": 425 },
      "vecinas": ["el-arbol", "el-templo", "el-galpon"]
    },
    {
      "id": "el-templo",
      "corto": "El templo",
      "nombre": "El templo de Momo",
      "canta": "Un galpón de luz y la murga.",
      "disco": "momo-sampler",
      "forma": { "tipo": "sector", "desde": 65, "hasta": 105, "adentro": 140, "afuera": 425 },
      "vecinas": ["cybersiberia", "los-astilleros", "el-galpon", "la-ruta"]
    },
    {
      "id": "los-astilleros",
      "corto": "Astilleros",
      "nombre": "Los astilleros",
      "canta": "Containers, un ferry y el río quieto.",
      "disco": "cordero-atado",
      "forma": { "tipo": "sector", "desde": 105, "hasta": 143, "adentro": 140, "afuera": 425 },
      "vecinas": ["el-templo", "el-bajo", "la-ruta"]
    },
    {
      "id": "el-bajo",
      "corto": "El bajo",
      "nombre": "El bajo inundado",
      "canta": "El agua entra por el vidrio roto.",
      "disco": "un-baion-para-el-ojo-idiota",
      "forma": { "tipo": "sector", "desde": 143, "hasta": 183, "adentro": 140, "afuera": 425 },
      "vecinas": ["los-astilleros", "el-infierno", "el-galpon"]
    },
    {
      "id": "el-infierno",
      "corto": "Infierno",
      "nombre": "El infierno encantador",
      "canta": "Esta noche está encantador.",
      "disco": "gulp",
      "forma": { "tipo": "sector", "desde": 183, "hasta": 217, "adentro": 140, "afuera": 425 },
      "vecinas": ["el-bajo", "la-prision", "la-ruta"]
    },
    {
      "id": "la-prision",
      "corto": "Prisión",
      "nombre": "La prisión de Barbazul",
      "canta": "Una jaula abierta y nadie adentro.",
      "disco": "oktubre",
      "forma": { "tipo": "sector", "desde": 217, "hasta": 255, "adentro": 140, "afuera": 425 },
      "vecinas": ["el-infierno", "los-techos"]
    },
    {
      "id": "los-techos",
      "corto": "Techos",
      "nombre": "Los techos y el baldío",
      "canta": "Gatos arriba, perros abajo.",
      "disco": "bang-bang-estas-liquidado",
      "forma": { "tipo": "sector", "desde": 255, "hasta": 295, "adentro": 250, "afuera": 425 },
      "vecinas": ["la-prision", "el-monte", "la-mesa"]
    },
    {
      "id": "el-monte",
      "corto": "El monte",
      "nombre": "El monte del lobo",
      "canta": "Se oye un aullido y no se ve.",
      "disco": "lobo-suelto",
      "forma": { "tipo": "sector", "desde": 295, "hasta": 340, "adentro": 250, "afuera": 425 },
      "vecinas": ["la-pastura", "los-techos", "el-arbol", "la-mesa"]
    },
    {
      "id": "la-pastura",
      "corto": "Pastura",
      "nombre": "La pastura del cordero",
      "canta": "Un palo, una soga, un círculo pelado.",
      "disco": "cordero-atado",
      "forma": { "tipo": "claro", "angulo": 317, "distancia": 330, "radio": 72 },
      "vecinas": ["el-monte", "la-mesa"]
    },
    {
      "id": "la-mesa",
      "corto": "La mesa",
      "nombre": "La mesa servida",
      "canta": "Una sopa con mosca y un caníbal.",
      "disco": "la-mosca-y-la-sopa",
      "forma": { "tipo": "sector", "desde": 255, "hasta": 340, "adentro": 140, "afuera": 250 },
      "vecinas": ["la-pastura", "los-techos", "el-monte", "el-galpon"]
    },
    {
      "id": "la-ruta",
      "corto": "La ruta",
      "nombre": "La ruta del último bondi",
      "canta": "Da la vuelta al mundo entero.",
      "disco": "ninguno",
      "forma": { "tipo": "anillo", "adentro": 432, "afuera": 476 },
      "vecinas": ["el-arbol", "el-templo", "los-astilleros", "el-infierno"]
    }
  ],
  "bestias": [
    {
      "id": "patricio-rey",
      "nombre": "Patricio Rey",
      "clase": "criatura",
      "region": "el-galpon",
      "pos": { "x": 500, "y": 470 },
      "tam": 52,
      "dibujo": { "f": "cosa", "que": "silla" },
      "articulo": "patricio-rey",
      "estampa": "En el medio del mundo redondo hay un galpón, y adentro una silla vacía. Es la suya. Nadie le vio nunca la cara, así que la estampa tampoco se la inventa.",
      "cuenta": [
        { "rotulo": "hecho", "texto": "Es un personaje inventado a propósito, para que el centro de la banda no fuera ninguno de los músicos.", "fuente": "RES-22" },
        { "rotulo": "testimonio", "texto": "Tenía departamento en París y un cuadro de Mondrian en el ascensor.", "quien": "Indio Solari, en «Recuerdos que mienten un poco»", "fuente": "RES-22" }
      ],
      "cerca": ["redonditos-de-ricota", "la-bestia-pop"]
    },
    {
      "id": "redonditos-de-ricota",
      "nombre": "Los redonditos de ricota",
      "clase": "criatura",
      "region": "el-galpon",
      "pos": { "x": 452, "y": 532 },
      "tam": 40,
      "dibujo": { "f": "cosa", "que": "bunuelos" },
      "articulo": "la-formacion",
      "estampa": "Una fuente de buñuelos al lado de la silla. Son los que le dieron el apellido a la banda, y en la estampa están para que agarre el que pase.",
      "cuenta": [
        { "rotulo": "hecho", "texto": "El nombre salió de la receta de unos buñuelos redondos de ricota, de un libro de la ecónoma Patricia Rey: la fuente dice Patricia, la banda dijo Patricio.", "fuente": "RES-05" }
      ],
      "cerca": ["patricio-rey"]
    },
    {
      "id": "la-bestia-pop",
      "nombre": "La bestia pop",
      "clase": "criatura",
      "region": "el-galpon",
      "pos": { "x": 548, "y": 528 },
      "tam": 50,
      "dibujo": { "f": "cosa", "que": "bestia-pop" },
      "tema": "la-bestia-pop",
      "verso": ["Vamos a brillar, mi amor"],
      "estampa": "Un bicho grande que brilla, parado en el escenario del galpón. No tiene cara fija: cada uno le pone la que quiere.",
      "cuenta": [
        { "rotulo": "testimonio", "texto": "En 1985 el Indio dijo que el tema era una joda a ellos mismos y al medio, y que la canción no tenía que agotar lo que resuena.", "quien": "Indio Solari, en La Nación (nota de 2020 que lo cita) y en su memoir", "fuente": "RES-341" },
        { "rotulo": "leyenda", "texto": "Circulan dos candidatos para ser la bestia: Carlos Monzón y el Negro José Luis, el de la barra de Gimnasia. El Indio los desmintió a todos.", "fuente": "RES-342" }
      ],
      "cerca": ["patricio-rey", "el-heroe-del-whisky"]
    },

    {
      "id": "el-senor-de-los-cielos",
      "nombre": "El señor de los cielos",
      "clase": "criatura",
      "region": "el-arbol",
      "pos": { "ang": 0, "r": 404 },
      "tam": 40,
      "dibujo": { "f": "persona", "con": ["cuchillo", "aureola"], "ropa": "tunica" },
      "tema": "el-arbol-del-gran-bonete",
      "verso": ["Su cuchillo de herrero afiló", "el señor en los cielos."],
      "estampa": "Sentado arriba de la copa, afilando. Lo que corta no se ve desde acá abajo.",
      "cerca": ["el-bicho-del-gran-bonete", "el-jocker-burlon"]
    },
    {
      "id": "el-bicho-del-gran-bonete",
      "nombre": "El bicho del gran bonete",
      "clase": "bestia",
      "region": "el-arbol",
      "pos": { "ang": -7, "r": 352 },
      "tam": 36,
      "dibujo": { "f": "cuadrupedo", "orejas": "redondas", "hocico": "corto", "cola": "larga", "pose": "trepa" },
      "tema": "el-arbol-del-gran-bonete",
      "verso": ["Miren lo que este bicho logró", "al confiar en sus sueños."],
      "estampa": "Trepado al árbol más alto del mundo redondo, abrazado a un fruto dulce y raro. Morderlo sale caro, y lo sabe.",
      "cerca": ["el-senor-de-los-cielos", "el-monito-que-trepa"]
    },
    {
      "id": "el-jocker-burlon",
      "nombre": "El jocker burlón",
      "clase": "personaje",
      "region": "el-arbol",
      "pos": { "ang": 11, "r": 300 },
      "tam": 36,
      "dibujo": { "f": "persona", "con": ["bonete"], "ropa": "saco" },
      "tema": "el-arbol-del-gran-bonete",
      "verso": ["Soy un jocker burlón", "de la \"Estrella del Sur\"."],
      "estampa": "Colgado de una rama baja con el bonete de tres puntas. Es el comodín: puede ser cualquier carta.",
      "cerca": ["el-bicho-del-gran-bonete"]
    },
    {
      "id": "el-monito-que-trepa",
      "nombre": "El monito que trepa",
      "clase": "bestia",
      "region": "el-arbol",
      "pos": { "ang": -11, "r": 275 },
      "tam": 32,
      "dibujo": { "f": "cuadrupedo", "orejas": "redondas", "hocico": "corto", "cola": "enrulada", "pose": "trepa" },
      "tema": "juguetes-perdidos",
      "verso": ["Cuanto más alto trepa el monito", "El culo más se le ve"],
      "estampa": "A media altura del tronco, subiendo. Desde abajo se le ve lo que el verso dice que se le ve.",
      "tambien": [{ "tema": "un-pacman-en-el-savoy", "verso": ["pero el mono es de él."] }],
      "cerca": ["el-bicho-del-gran-bonete", "el-pac-man"]
    },
    {